### ISSUE TITLE
How to make keep-alives work with UIPEthernet ?

### ISSUE THREAD

**Issue by Schmavster** [ntruchsess/arduino_uip#84]
HI Norbert

I am hoping you can help me with a performance issue using the UIPEthernet library

I have a remote webpage that needs to send requests with querystring parameters to the arduino  about 10 times per second. This is done using a xmlhttprequest.

I have come across a limit where I can only make about 4 requests per second.  Running a wireshark trace I can see that after the arduino response packet, there is a 200mS delay before the webpage sends the ACK and therefore only 4 requests per second is possible. The actual time the Nano to process the request is only about 30mS

274 8.349347000 192.168.0.4 192.168.0.100   HTTP    377 GET /?D2=7&D3=6&D4=6&D5=5&D6=4&D7=3&D8=0&D9=0& HTTP/1.1
275 8.352839000 192.168.0.100   192.168.0.4 TCP 60  http > 49826 [ACK] Seq=1 Ack=324 Win=512 Len=0
276 8.379246000 192.168.0.100   192.168.0.4 HTTP    175 HTTP/1.1 200 OK  (text/html)
277 8.578738000 192.168.0.4 192.168.0.100   TCP 54  49826 > http [ACK] Seq=324 Ack=122 Win=65271 Len=0
278 8.581039000 192.168.0.100   192.168.0.4 TCP 60  http > 49826 [FIN, ACK] Seq=122 Ack=324 Win=512 Len=0
279 8.581080000 192.168.0.4 192.168.0.100   TCP 54  49826 > http [ACK] Seq=324 Ack=123 Win=65271 Len=0
280 8.581259000 192.168.0.4 192.168.0.100   TCP 54  49826 > http [FIN, ACK] Seq=324 Ack=123 Win=65271 Len=0
281 8.583686000 192.168.0.100   192.168.0.4 TCP 60  http > 49826 [ACK] Seq=123 Ack=325 Win=512 Len=0
282 8.592909000 192.168.0.4 192.168.0.100   TCP 66  49827 > http [SYN] Seq=0 Win=8192 Len=0 MSS=1460 WS=4 SACK_PERM=1
283 8.595674000 192.168.0.100   192.168.0.4 TCP 60  http > 49827 [SYN, ACK] Seq=0 Ack=1 Win=512 Len=0 MSS=512
284 8.595703000 192.168.0.4 192.168.0.100   TCP 54  49827 > http [ACK] Seq=1 Ack=1 Win=65392 Len=0
285 8.595877000 192.168.0.4 192.168.0.100   HTTP    377 GET /?D2=8&D3=6&D4=6&D5=6&D6=5&D7=3&D8=1&D9=0& HTTP/1.1  

However, if I use the same webpage to send the same requests to an IIS webserver, there is no ACK seen and I can easily send around 30 requests per second.

19  0.886333000 192.168.0.4 202.122.100.47  HTTP    404 GET /test/receiver.aspx?D2=8&D3=6&D4=6&D5=6&D6=4&D7=4&D8=1&D9=0& HTTP/1.1 
20  0.918847000 202.122.100.47  192.168.0.4 HTTP    364 HTTP/1.1 200 OK  (text/html)
21  0.935126000 192.168.0.4 202.122.100.47  HTTP    404 GET /test/receiver.aspx?D2=8&D3=6&D4=6&D5=6&D6=5&D7=4&D8=1&D9=0& HTTP/1.1 
22  0.965219000 202.122.100.47  192.168.0.4 HTTP    364 HTTP/1.1 200 OK  (text/html)
23  0.985143000 192.168.0.4 202.122.100.47  HTTP    404 GET /test/receiver.aspx?D2=7&D3=6&D4=6&D5=6&D6=5&D7=4&D8=1&D9=0& HTTP/1.1 
24  1.021250000 202.122.100.47  192.168.0.4 HTTP    364 HTTP/1.1 200 OK  (text/html)

I think the later is because keep-alives means that it does not have to complete a handshake for each request.  How can I do this with the UIPEthernet library ?

Thank you in advance
Gavin
